Filename,Title,Source,SHA-1,Date,Year
AhnLab_Analysis-Report-of-Kimsuky-Group(01-05-2022),"Kimsuky Group's APT Attacks (AppleSeed, PebbleDash)",Ahnlab,3cef77aed2d0be3eeacd1f63d421ece2656f7a93,01/05/2022,2022
CISA_AA22-011A_TLP-WHITE_01-10-22_v1(01-11-2022),Understanding and Mitigating Russian State-Sponsored Cyber Threats to U.S. Critical Infrastructure,cisa,61a5eb27ef3e633be66583c127de39fe19be7fb8,01/11/2022,2022
Zscaler_Molerats-APT-targeting-Middle-East(01-20-2022),New espionage attack by Molerats APT targeting users in the Middle East,zscaler,ccd8bb80544272f65b22974f8769c60a60e09ee6,01/20/2022,2022
mp.weixin.qq.com_Falseflag-Sea-lotus-Glitch(01-20-2022),False flag or upgrade? Suspected sea lotus uses the Glitch platform to reproduce the attack sample,Blog,35428b46bb9785b339a3459fb35e184d711dbb99,01/20/2022,2022
Trellix_PrimeMinisters-Details-Espionage-Campaign(01-25-2022),Prime Minister's Office Compromised: Details of Recent Espionage Campaign,Trellix,3593410f781e8eb7a90bf4416630e3d34f6eec0f,01/25/2022,2022
bfv_cyber-brief-Nr1(01-26-2022),BfV Cyber-Brief Nr. 01/2022,BfV,c17307c0c37e409e7fc8a7b163b82670f3fce9b2,01/26/2022,2022
MalwareBytes_NorthKoreas-Lazarus-APT-Windows-Update-GitHub(01-27-2022),"North Korea's Lazarus APT leverages Windows Update client, GitHub in latest campaign",MalwareBytes,99973488f071190f68c62602b55da4c1e6f5c339,01/27/2022,2022
Crowdstrike_StellarParticle-Campaign-Novel-Tactics-Techniques(01-27-2022),Observations from the StellarParticle Campaign,crowdstrike,a16e7cba15ff41a224278d6cb7037e65d8cf6e8b,01/27/2022,2022
CyberGeeks_Lazarus-Malware-Notepad-Shell-Extension(01-31-2022),A detailed analysis of Lazarus APT malware disguised as Notepad++ Shell Extension,Cyber Geeks,c6ac7b0a3ee46801869cb818527c42054be86652,01/31/2022,2022
Symantec_Shuckworm-Cyber-Attacks-Ukraine(01-31-2022),Shuckworm Continues Cyber-Espionage Attacks Against Ukraine,Symantec,c345da781e48105661251b94261c83e8d52058d2,01/31/2022,2022
cert.gov.ua_CERT-UA-3799(02-02-2022),Cyber attack of UAC-0056 group on state organizations of Ukraine using malicious programs SaintBot and OutSteel (CERT-UA #3799),CERT-UA,f2d9a3ed66dbeb41b5887dab7308059f8e3e6fc4,02/02/2022,2022
Symantec_Antlion-ChineseAPT-Target-Financial-Taiwan(02-03-2022),Antlion Chinese APT Uses Custom Backdoor to Target Financial Institutions in Taiwan,Symantec,b1bd49f1ce653a470d0a8be83bb02b9140eeba34,02/03/2022,2022
PaloAltoNetworks_Russias-Gamaredon-PrimitiveBear-Targeting-Ukraine(02-03-2022),Gamaredon (Primitive Bear) Russian APT Group Actively Targeting Ukraine,palo alto networks,80649c8b4cfc9987a5b747021917cd53f2c433e5,02/03/2022,2022
Microsoft_ACTINIUM-Ukrainian-organizations(02-04-2022),ACTINIUM targets Ukrainian organizations,microsoft,58a7dc800d633da1fad1756815d0e71ad120b60f,02/04/2022,2022
Kaspersky_Roaming-Mantis-reaches-Europe(02-07-2022),Roaming Mantis reaches Europe,Kaspersky,137293cfe2aa7df93d22e44862dbfac8f6ff3aa5,02/07/2022,2022
Proofpoint_UggBoots-Palestinian-Aligned-Espionage(02-08-2022),Ugg Boots 4 Sale: A Tale of Palestinian-Aligned Espionage,proofpoint,eb3ae8c7166d76aa564ab94457383f5321b45f81,02/08/2022,2022
SentinalOne_modified-elephant-apt(02-09-2022),Modified Elephant APT and a Decade of Fabricating Evidence,SentinalOne,892e3677718b44d08c8b95f63867c55215931363,02/09/2022,2022
HVSConsulting_EmissaryPanda(02-14-2022),"The APT fallout of vulnerabilities such as ProxyLogon in Exchange (Hafnium), OGNL injection, and log4shell",HVS Consulting,957289a738576160892bcaca22df777d63d586ed,02/14/2022,2022
Fortinet_DriveGuard-Moses-Staff-Campaigns(02-15-2022),Guard Your Drive from DriveGuard: Moses Staff Campaigns Against Israeli Organizations Span Several Months,fortinet,d10d8afa48caf110f7e2261e6a5521231d96800d,02/15/2022,2022
Proofpoint_Charting-TA2541s-Flight(02-15-2022),Charting TA2541's Flight,proofpoint,baccd5c5f70b4f98227f3628558b3e4a0d2ceb84,02/15/2022,2022
Telsy_BabaDeda-LorecCPL-Outsteel-Ukraine(02-16-2022),BabaDeda and LorecCPL downloaders used to run Outsteel against Ukraine,telsy,4622da4f28cb5b28c61aaebc8eaa43ed4bfd45e2,02/16/2022,2022
nsfocus_Lorec53-LoriBear-Ukraine(02-16-2022),APT Group LOREC53 (Lori Bear) Recently Launched A Large-Scale Cyber Attack On Ukraine,nsfocus,d883d94dd0cc7257751177e42a32bd5a85796b03,02/16/2022,2022
alyac_NKorea-digital-asset-wallet-customer-center(02-16-2022),North Korea-linked APT attack found disguised as a digital asset wallet service customer center,ESTSecurity,fdf53fac0af9cced76179fb1b9df0ce009952e36,02/16/2022,2022
Sentinelone_Log4j2-TunnelVision-Exploiting-VMware-Horizon(02-17-2022),Iranian-Aligned Threat Actor ,SentinelOne,29ba4e36eaa5cd7c1a612f10f7ba53fb275cd6e5,02/17/2022,2022
Sentinelone_HermeticWiper-Ukraine(02-23-2022),HermeticWiper - New Destructive Malware Used In Cyber Attacks on Ukraine,sentinelone,6889710cb527eb5d941412a7145d68bbbfa12a10,02/23/2022,2022
Mandiant_UNC2596-Observed-Leveraging-Vulnerabilities-Cuba-Ransomware(02-23-2022),UNC2596 Observed Leveraging Vulnerabilities to Deploy Cuba Ransomware,Mandiant,97d56a7fe645bf9914b5547b5efa6f3ef3234ac0,02/23/2022,2022
CISA_AA22-055A_Iranian_Government-Sponsored_Actors_Conduct_Cyber_Operations(02-24-2022),Iranian Government-Sponsored Actors Conduct Cyber Operations Against Global Government and Commercial Networks,cisa,cd6ceecd02ed516cf106bf855e81fd26b1b51aed,02/24/2022,2022
Symantec_Ukraine-Disk-wiping-Russian-Invasion(02-24-2022),Ukraine: Disk-wiping Attacks Precede Russian Invasion,Symantec,63e5676ff2013e825dc31e0631369dd466bc4599,02/24/2022,2022
PaloAltoNetworks_SockDetour-Fileless-Socketless-Backdoor(02-24-2022),SockDetour Backdoor Targets U.S. Defense Contractors,palo alto networks,7f8679add7d3c25bc6f32fb644a1ee78eb007c7b,02/24/2022,2022
Mandiant_Telegram-Malware-Iranian-Activity(02-24-2022),Telegram Malware Spotted in Latest Iranian Cyber Espionage Activity,mandiant,20ceb7bd73b288a0f83d8e9c7c70f2f6bdb876a9,02/24/2022,2022
Fortinet_Nobelium-Returns(02-24-2022),Nobelium Returns to the Political World Stage,Fortinet,dd9bef5bda6d31741d435529fc2193c89bdf4a19,02/24/2022,2022
PaloAlto_Spear-Phishing-Ukraine-OutSteel(02-25-2022),"OutSteel, SaintBot Delivered by Spear Phishing Attacks Targeting Ukraine",Palo Alto Networks,60dcb5754259d9b9ef82db3a226b8f9409a6e7fb,02/25/2022,2022
CISA_AA22-057A_Destructive_Malware_Targeting_Organizations_in_Ukraine(02-26-2022),Destructive Malware Targeting Organizations in Ukraine,cisa,4e0945984dd92c9f9cdcf37350d5df56e28311f8,02/26/2022,2022
ESET_IsaacWiper-HermeticWizard-targeting-Ukraine(03-01-2022),IsaacWiper and HermeticWizard: New wiper and worm targeting Ukraine,ESET,3c60522829454e2b55e2f2544e24668948bf980a,03/01/2022,2022
Proofpoint_Asylum-Ambuscade-Ukrainian-Military-Emails-Target-European(03-01-2022),Asylum Ambuscade: State Actor Uses Compromised Private Ukrainian Military Emails to Target European Governments and Refugee Movement,proofpoint,2972b297a603cd2b70e365ce6db4d58846cdb802,03/01/2022,2022
RecordedFuture_mtp-2022-0302(03-02-2022),HermeticWiper and PartyTicket Targeting Computers in Ukraine,RecordedFuture,afd4c1685181d626ba8169f95ba50c655dd8d33d,03/02/2022,2022
Ahnlab_Malicious-Hangul-disguised-pressreleases-presidential-election(03-03-2022),Distribution of malicious Hangul documents disguised as press releases for the 20th presidential election,Ahnlab,4ed602d14da6ffdcef5a9a04f1adfe906f2bca2e,03/03/2022,2022
Mandiant_Summary-APT41-Targeting-US-State-Governments(03-08-2022),A Summary of APT41 Targeting U.S. State Governments,Mandiant,4625a11ec7fb6b97ac5e4882aec5c1a143483bef,03/08/2022,2022
Lab52_Lazyscripters-double-compromise-single-obfuscation(03-09-2022),Very very lazy Lazyscripter's scripts: double compromise in a single obfuscation,Lab52,7f124e29c43dfa42c4e4d87b26bd3e18d15d21d4,03/09/2022,2022
Cisco_Iranian-MuddyWater-regionally-focused-subgroups(03-10-2022),Iranian linked conglomerate MuddyWater comprised of regionally focused subgroups,talosintelligence,367ba69c8a0502752e921709a50e98b72a8903da,03/10/2022,2022
CISA_AA22-074A_Russian_State-Sponsored_Cyber_Actors_Gain_Network_Access_by_Exploiting_Default_MFA_and_PrintNightmare(03-15-2022),Russian State-Sponsored Cyber Actors Gain Network Access by Exploiting Default Multifactor Authentication Protocols and ,CISA,8df1840dd0b1f01264da0b9d90fa6d7eabff892d,03/15/2022,2022
Sentinelone_UAC-0056-Targeting-Ukraine-Fake-Translation-Software(03-15-2022),Threat Actor UAC-0056 Targeting Ukraine with Fake Translation Software,Sentinelone,000215f424ffd26d7d1b06832490fec8a501e8eb,03/15/2022,2022
Mandiant_An-Overview-of-UNC2891(03-16-2022),An Overview of UNC2891,Mandiant,bf8e86195d1ccbd22938606a9f2f9086f91c6dfc,03/16/2022,2022
Proofpoint_Serpent-Backdoor-Targets-French-Entities(03-21-2022),"Serpent, No Swiping! New Backdoor Targets French Entities with Unique Attack Chain",Proofpoint,6fa14891cb1ded25243eedebcf706769b9db24d1,03/21/2022,2022
TheDFIRReport_APT35-Automates-Initial-Access-Using-ProxyShell(03-21-2022),APT35 Automates Initial Access Using ProxyShell,TheDFIRreport,8b002310687d229d011cb32a6c888ffc2469c491,03/21/2022,2022
Avast_Operation-Dragon-Castling-APT-targeting-betting-companies(03-22-2022),Operation Dragon Castling: APT group targeting betting companies,Avast,57578072d22b95901e875f19cfb7ead3002d07f1,03/22/2022,2022
CISA_AA22-054A New Sandworm Malware Cyclops Blink Replaces VPN Filter(03-23-2022),New Sandworm Malware Cyclops Blink Replaces VPNFilter,CISA,1e7b9c2fb9c9533572df9070f118b15bdbcb6104,03/23/2022,2022
DrWeb-telecom_research_en(03-24-2022),Study of an APT attack on a telecommunications company in Kazakhstan,DrWeb,c848df52070b8baac8ccb65d4a223c2370e75469,03/24/2022,2022
cert.gov.ua-CERT-UA-4293(03-28-2022),UAC-0056 cyberattack on Ukrainian authorities using GraphSteel and GrimPlant malware,CERT_UA,e557448d4f67e12c6427dd89258b166a91b04ba7,03/28/2022,2022
Malwarebytes_spear-phishing-targets-Russian-dissidents(03-29-2022),New spear phishing campaign targets Russian dissidents,malwarebytes,e4ea89258b2eae980abd091e9b813783422fb4e4,03/29/2022,2022
Ahnlab-APT-disguised-NorthKorean-defector-resume-VBS-script(03-29-2022),APT attack disguised as North Korean defector resume format ,Ahnlab,c5d7e2c9666e64d3d2c303b365b38a07e24026a6,03/29/2022,2022
CiscoTalos_TransparentTribe-bespoke-malware-target-Indian-gov-officials(03-29-2022),Transparent Tribe campaign uses new bespoke malware to target Indian government officials,Cisco,0c0ff45c3ade035d3827a8850ac0cc6c3b067446,03/29/2022,2022
QAX_VajraEleph-Cyber-espionage-against-Pakistani-military(03-30-2022),VajraEleph from South Asia - Cyber espionage against Pakistani military personnel revealed,QAX,a1c958967e9f8aa2caf1633099e2223b83b6ebd0,03/30/2022,2022
Fortinet_DeepPanda-Log4Shell-Digitally-Signed-Fire-Chili-Rootkits(03-30-2022),New Milestones for Deep Panda: Log4Shell and Digitally Signed Fire Chili Rootkits,Fortinet,065fe12cd3ae9dd718d0d2d9032ff16f2e12d7a8,03/30/2022,2022
Kaspersky_Lazarus-Trojanized-DeFi-delivering-malware(03-31-2022),Lazarus Trojanized DeFi app for delivering malware,Kaspersky,3ca55acc1173d75d9cbf3beb66dfb32e7503e957,03/31/2022,2022
Sentinelone_AcidRain-Wiper-Rains-Down-Europe(03-31-2022),AcidRain: A Modem Wiper Rains Down on Europe,Sentinelone,3e9f3cd1c4cf394a7bdaa9f918b6bc0407de7346,03/31/2022,2022
RecordedFuture_Chinese-targeting-IndianPowerGrid-ta-2022-0406(04-06-2022),Continued Targeting of Indian Power Grid Assets by Chinese State-Sponsored Activity Group,recordedfuture,0b1b32b1d1f2cf93f41966c2eb607df4845a1c5f,04/06/2022,2022
Qianxin_Analysis of the Suspected Lazarus Attack Activities against South Korean Companies(04-11-2022),Snow abuse and gluttony: Analysis of suspected Lazarus attack activities against Korean companies,Qianxin,d2c884f5d1d49194f6688d640bb71dbb50ad332e,04/11/2022,2022
Microsoft_Tarrask-malware-scheduled-tasks-defense-evasion(04-12-2022),Tarrask malware uses scheduled tasks for defense evasion,microsoft,0d80c5b363a71f4f69736cddf9b9bc2e1a632697,04/12/2022,2022
cert.gov.ua-CERT-UA-4435(04-12-2022),Cyberattack by Sandworm Group (UAC-0082) on energy facilities of Ukraine using malicious programs INDUSTROYER2 and CADDYWIPER,CERT-UA,69ff06f54e2333e8102da79694ce8cb2429fac5d,04/12/2022,2022
cert.gov.ua-CERT-UA-4435(04-12-2022),Cyberattack by Sandworm Group (UAC-0082) on energy facilities of Ukraine using malicious programs INDUSTROYER2 and CADDYWIPER,CERT-UA,69ff06f54e2333e8102da79694ce8cb2429fac5d,04/12/2022,2022
Symantec_Lazarus-Targets-Chemical-Sector(04-14-2022),Lazarus Targets Chemical Sector,Symantec,be31a634d4139e6223c50cc18cc69916ba585475,04/14/2022,2022
cert.gov.ua-CERT-UA-4464(04-14-2022),Cyberattack on state organizations of Ukraine using the malicious program IcedID,CERT-UA,24129608075aa7b7a8e3a726a5b009c30bae881e,04/14/2022,2022
inquest_Nobelium-Israeli-Embassy-Maldoc(04-18-2022),Nobelium - Israeli Embassy Maldoc,Inquest,609414f31b49c22b7d212df8686ab2a5d1daa9d6,04/18/2022,2022
cert.gov.ua-CERT-UA-4490(04-18-2022),"Cyberattack on state organizations of Ukraine using the topic ""Azovstal""",CERT-UA,6c477457f9443000c20ae8292713e926dc12ad97,04/18/2022,2022
Ahnlab-Lazarus-attack-group-exploits-INITECH-process(04-18-2022),Lazarus attack group that exploits the INITECH process,Ahnlab,bdbe3c5510aab146d327e72ab50768503021175b,04/18/2022,2022
CISA_AA22-108A-TraderTraitor-North_Korea_APT_Targets_Blockchain_Companies(04-18-2022),TraderTraitor: North Korean State-Sponsored APT Targets Blockchain Companies,CISA,49f91b6196d02311aa43b5c72bbd28b7d1d3b905,04/18/2022,2022
Symantec-Shuckworm-Espionage-Group-Campaign-Against-Ukraine(04-20-2022),Shuckworm: Espionage Group Continues Intense Campaign Against Ukraine,Symantec,d6d27a3621ad8ef77df6c6c9644d8deb4a32c2ba,04/20/2022,2022
Stairwell-threat-report-The-ink-stained-trail-of-GOLDBACKDOOR(04-21-2022),The ink-stained trail of GOLDBACKDOOR,stairwell,095c763cb66c58a7f61e97b0dcd7328ae0a51d59,04/21/2022,2022
Zscaler-Naver-ending-game-Lazarus-APT(04-26-2022),"A ""Naver"" ending game of Lazarus APT",zscaler,e2b266f4afeaf7b3f608df75ab62abdc23f7941f,04/26/2022,2022
Symantec_Stonefly-North Korea-Continues-High-value-Targets(04-27-2022),Stonefly: North Korea-linked Spying Operation Continues to Hit High-value Targets,Symantec,ec0ff900599235d4e4103a9c6ea980ff54cc0a2c,04/27/2022,2022
nccgroup_LAPSUS-Recent-TTPs(04-28-2022),"LAPSUS$: Recent techniques, tactics and procedures",nccgroup,e8c33cefaf9dc42acf2d668cf78d781fdf17c240,04/28/2022,2022
CISA_AA22-057A_Destructive_Malware_Targeting_Organizations_in_Ukraine-r2(04-28-2022),Update: Destructive Malware Targeting Organizations in Ukraine,cisa,1d7d0bb200a0725926d92c5bea1f452453efcfec,04/28/2022,2022
Mandiant_UNC3524-Eye-Spy-Email(05-02-2022),UNC3524: Eye Spy on Your Email,Mandiant,88eac247905e7a62616e25117c29997cb3660307,05/02/2022,2022
CiscoTalos_GamaredonAPT-targets-Ukrainian-new-campaign(09-15-2022),Gamaredon APT targets Ukrainian government agencies in new campaign,CiscoTalos,abee4fba459156eb4b681f95337c5fade2e24385,09/15/2022,2022
Checkpoint_Cloud-Atlas-targets-Russia-Belarus-amid-Ukraine(12-09-2022),Cloud Atlas targets entities in Russia and Belarus amid the ongoing war in Ukraine,checkpoint,ce2bb5a0741a4bdd6f9cb96a205603388c2e8323,12/09/2022,2022
PaloAlto_Russias-TridentUrsa-GamaredonAPT-CyberConflic-Operations-Ukraine(12-20-2022),Russia's Trident Ursa (aka Gamaredon APT) Cyber Conflict Operations Unwavering Since Invasion of Ukraine,Palo Alto,7ffa8cc48d900c15e6ac08b104610f82011496c5,12/20/2022,2022
Checkpoint_BlindEagle-Targeting-Ecuador-Sharpened-Tools(01-05-2023),BlindEagle Targeting Ecuador With Sharpened Tools,checkpoint,3a904da819b8adb107998f6408249cf29ce950cb,01/05/2023,2023
Group-ib_DarkPink(01-11-2023),"Dark Pink: New APT hitting Asia-Pacific, Europe that goes deeper and darker",Group-ib,e5c9ee752a09cc290bd5bd6c40b9c14241586ff7,01/11/2023,2023
Eclecticiq_MustangPandaAPT-EUThemed-Lure-PlugX(02-02-2023),Mustang Panda APT Group Uses European Commission-Themed Lure to Deliver PlugX Malware,Eclecticiq,f9dc47847698fb913f004b17525a16d37a7c711c,02/02/2023,2023
Trendmicro_New-APT34-Malware-Targets-MiddleEast(02-02-2023),New APT34 Malware Targets The Middle East,Trend Micro,8e4de1d12b7d3b27bb649689bab287dcf1f5fe46,02/02/2023,2023
Symantec_Graphiron-Russian-Malware-Deployed-Against-Ukraine(02-08-2023),Graphiron: New Russian Information Stealing Malware Deployed Against Ukraine,Symantec,232cfeb4ee7a1e9aae111eebb5574dcc970e0d9b,02/08/2023,2023
Ahnlab_Dalbit-m00nlight-Chinese-APT-Campaign(02-13-2023),Dalbit (m00nlight): Chinese Hacker Group's APT Attack Campaign,Ahnlab,f8464b2e4c8ac43e64aaf9c3034286da17a2b91b,02/13/2023,2023
Checkpoint_Operation-Silent-Watch-Desktop-Surveillance-Azerbaijan-Armenia(02-16-2023),Operation Silent Watch: Desktop Surveillance in Azerbaijan and Armenia,Checkpoint,b897b76560babe5ea2af500b12ce15160c39944f,02/16/2023,2023
Ahnlab_HWP-Malware-Steganography-ScarCruft(02-21-2023),HWP Malware Using the Steganography Technique: RedEyes (ScarCruft),AhnLab,18f2fa0dd7b7178ba88d5a5d412d86bf3df43c28,02/21/2023,2023
Symantec_Hydrochasma-UnknownGroup-Targets-Medical-Shipping-Asia(02-22-2023),Hydrochasma: Previously Unknown Group Targets Medical and Shipping Organizations in Asia,Symantec,5669fa6adf6841e8d550e03636e13e39cc8e4560,02/22/2023,2023
ESET_WinorDLL64-Lazarus-arsenal(02-23-2023),WinorDLL64: A backdoor from the vast Lazarus arsenal?,ESET,29308a374352e9b10395a445b54d29c44fa1a954,02/23/2023,2023
Blackberry_BlindEagle-Fake-UUE-Fsociety-Target-Colombia(02-27-2023),Blind Eagle Deploys Fake UUE Files and Fsociety to Target Colombia,Blackberry,669282e93ad3ee2f09ca00538a9e9f9d474dcb9b,02/27/2023,2023
Ahnlab_Lazarus-using-public-certificate-vulnerability(02-27-2023),Lazarus group using public certificate vulnerability,Ahnlab,9f0ac45dbfeeded1ad46f09e104640566c8f7eda,02/27/2023,2023
Symantec_Blackfly_Materials_Technology(02-28-2023),Blackfly: Espionage Group Targets Materials Technology,Symantec,4267c0947c6c196ac1f13f4ae440231f1828a67e,02/28/2023,2023
Trendmicro_IronTigers-SysUpdate-Adds-Linux-Targeting(03-01-2023),"Iron Tiger's SysUpdate Reappears, Adds Linux Targeting",Trend Micro,5af93af18d82bd2525635dc8a5d29126e05207ee,03/01/2023,2023
ESET_MQsTTang-MustangPandas-backdoor-Qt-MQTT(03-02-2023),MQsTTang: Mustang Panda's latest backdoor treads new ground with Qt and MQTT,ESET,a315b44bfa8879deee5d9ee550e6bdf1516c6258,03/02/2023,2023
Proofpoint_Russia-Aligned-TA499-Beleaguers-Targets-Video-Call-Requests(03-07-2023),Don't Answer That! Russia-Aligned TA499 Beleaguers Targets with Video Call Requests,Proofpoint,12f3a174311f611263f75c3b1d62f69b11c53560,03/07/2023,2023
Checkpoint_Chinese-Espionage-Southeast-Asian-Government-Entities(03-07-2023),Pandas with a Soul: Chinese Espionage Attacks Against Southeast Asian Government Entities,Checkpoint,d1a6a9b7fbd5a94cdd7b325883da3e413d4f8ffc,03/07/2023,2023
Mandiant_LIGHTSHOW-1-North-Koreas-UNC2970(03-09-2023),Stealing the LIGHTSHOW (Part One) - North Korea's UNC2970,Mandiant,e9325a67d4681c8cdfc1e2a18783142e2e74826c,03/09/2023,2023
Mandiant_LIGHTSHOW-2-LIGHTSHIFT-and-LIGHTSHOW(03-09-2023),Stealing the LIGHTSHOW (Part Two) - LIGHTSHIFT and LIGHTSHOW,Mandiant,604ce904b72ea33febb00802b7b26f4d782f6f67,03/09/2023,2023
360_APT-C-56-TransparentTribe-camouflage-campaign(02-13-2023),Analysis of APT-C-56 (Transparent Tribe) camouflage resume attack campaign,CoreSec360,39ab8916e64fe878e3198b82bc0bfd0b78c8e8cd,03/13/2023,2023
ESET_Tick-APT-compromise-DLP-developer-East-Asia(03-14-2023),The slow Ticking time bomb: Tick APT group compromise of a DLP software developer in East Asia,ESET,23219da0963e95373d5dacba4348f1ccd274fd59,03/14/2023,2023
Mandiant_Fortinet-Zero-Day-Suspected-Chinese-Operation(03-16-2023),Fortinet Zero-Day and Custom Malware Used by Suspected Chinese Actor in Espionage Operation,mandiant,d4d5053d7057f5fd24a4e431de95c2efc33b3a59,03/16/2023,2023
ESET_apt-activity-report-q2-2023-q3-2023(10-26-2023),ESET APT Activity Report Q2-Q3 2023,ESET,7873f4b161d89a40f97a4b4104f212f4d556459a,10/26/2023,2023
Kaspersky_cascade-of-compromise-unveiling-Lazarus-new-campaign(10-27-2023),A cascade of compromise: unveiling Lazarus' new campaign,Kaspersky,d88076abd0fbde4927a2948ca8065659e9ba6752,10/27/2023,2023
CoreSec360_APT-C-36-BlindEagle-Amadey-botnet(10-31-2023),Analysis of activities of suspected APT-C-36 (Blind Eagle) organization launching Amadey botnet Trojan,CoreSec360,5e1d8f90ff100844c70bc6c663ffe26771881cd7,10/31/2023,2023
Checkpoint_Fro-Albania-to-MiddleEast-Scarred-Manticore(10-31-2023),From Albania To The Middle East: The Scarred Manticore Is Listening,Checkpoint,18c0a89c955b06ef112a48590e14879c919c72b4,10/31/2023,2023
Deepinstinct_MuddyWater-spearphishing-new-TTPs(11-01-2023),MuddyWater eN-Able spear-phishing with new TTPs,deepinstinct,d3bf493f5cb37521928b92e9eee3af89d0f3bf82,11/01/2023,2023
Kaspersky_Modern-Asian-APT-groups-TTPs_report_eng(11-09-2023),Modern Asia APT groups TTPs,Kaspersky,ab3211cc642317a62c5330b640f24f08c3efb090,11/09/2023,2023
Kaspersky_HrServ-webshell-in-APT-attack(11-22-2023),HrServ - Previously unknown web shell used in APT attack,Kaspersky,312885ec160f68228c8ec450e3f61b54a25e17d5,11/22/2023,2023
Blackberry_AeroBlade-Targeting-US-Aerospace-Industry(11-30-2023),AeroBlade on the Hunt Targeting the U.S. Aerospace Industry,Blackberry,ef854d3ab06b7acc16e2ab04a760468966d07805,11/30/2023,2023
PaloAlto_NewToolSet-Organizations-in-Middle-East-Africa-and-US(12-01-2023),"New Tool Set Found Used Against Organizations in the Middle East, Africa and the US",Palo Alto Networks,e16339ec8a52ad200eae8d0fb6be95550d8f9c07,12/01/2023,2023
Ahnlab_Kimsuky-Group-AutoIt-Malware-RftRAT-Amadey(12-08-2023),"Kimsuky Group Uses AutoIt to Create Malware (RftRAT, Amadey)",Ahnlab,a224702fbdf785b482d562117dddf5d4fd848208,12/08/2023,2023
ITG05_operations_leverage_Israel-Hamas_conflict_lures_to_deliver_Headlace_malware(12-08-2023),ITG05 operations leverage Israel-Hamas conflict lures to deliver Headlace malware,IBM,c4e23fff156bef106fb15a96734b9fcf44d37061,12/08/2023,2023
CISA_aa23-347a-russian-foreign-intelligence-service-svr-exploiting-jetbrains-teamcity-cve-globally_0(12-13-2023),Russian Foreign Intelligence Service (SVR) Exploiting JetBrains TeamCity CVE Globally,CISA,443181071d70821ccd4f78533f8b6b9947dc4b46,12/13/2023,2023
Sentinelone_GazaCybergang -UnifiedFront-Targeting-Opposition(12-14-2023),Gaza Cybergang Unified Front Targeting Hamas Opposition,Sentinelone,e8a83611d700dbc67bff004984b05714471b00c4,12/14/2023,2023
ESET_OilRig-cloud-service-powered-downloaders(12-14-2023),OilRig's persistent attacks using cloud service-powered downloaders,ESET,1c9fb3d84f4702a0ae479b9e8f5c61ed27547d74,12/14/2023,2023
Symantec_Seedworm-Iranian-Hackers-Target-Telecoms-Orgs-North-East-Africa(12-19-2023),Seedworm: Iranian Hackers Target Telecoms Orgs in North and East Africa,Symantec,247bc49a579b858eb7c50a9a6cb23ab022c8e1d2,12/19/2023,2023
Netskope_Nim-based-Campaign-Word-Docs-Impersonate-Nepali-Gov(12-20-2023),A Look at the Nim-based Campaign Using Microsoft Word Docs to Impersonate the Nepali Government,Netskope,3f76b2e6e9861c0c3e4205dfeb5a9868539f4bb6,12/20/2023,2023
CERT-UA-8338(12-21-2023),New UAC-0050 attack using RemcosRAT,CERT-UA,0d7df9ae534779b6ee238c2d882e75e7b80797e0,12/21/2023,2023
Deepinstinct_TA-UAC-0099-Continues-Target-Ukraine(12-21-2023),Threat Actor 'UAC-0099' Continues to Target Ukraine,Deepinstinct,b0cce40bbc4e54a2742d25794bc5311cd958c2b2,12/21/2023,2023
Kaspersky_OperationTriangulation-TheLastMystery(12-27-2023),Operation Triangulation: The last (hardware) mystery,Kaspersky,837998879b95838c33584012305e7d1fd23827ff,12/27/2023,2023
CERT-UA-8399(12-28-2023),APT28: From Initial Damage to Domain Controller Threats in an Hour,CERT-UA,655acdbba1095c8339c40f02d2af3d3da50d22c4,12/28/2023,2023
Cyble_OperationShadowCat-Targeting-Indian-Political-Observers(07-24-2024),Operation ShadowCat: Targeting Indian Political Observers via a Stealthy RAT,cyble,0b7549d2bf3b39256c32f3b4924113d0fec9c817,07/24/2024,2024
